ID2,Sector,ID,Subsector,P1,P2,cluster
33,Manufacturing,335224,Household laundry equipment manufacturing OR Household laundry equipment manufacturing,25.824625,31.949411,0
31,Manufacturing,315290,Other cut and sew apparel manufacturing OR Other cut and sew apparel manufacturing,24.043339,29.101185,0
62,Health Care and Social Assistance,624A00,Individual and family services OR Individual and family services,25.660656,33.928314,0
62,Health Care and Social Assistance,624400,Child day care services OR Child day care services,24.968193,32.65276,0
33,Manufacturing,337121,Upholstered household furniture manufacturing OR Upholstered household furniture manufacturing,26.47202,30.034885,0
32,Manufacturing,321991,"Manufactured home, mobile home, manufacturing OR Manufactured home, mobile home, manufacturing",27.141705,27.032055,0
62,Health Care and Social Assistance,623000,Nursing and residential care facilities OR Nursing and residential care facilities,26.147614,32.808002,0
71,"Arts, Entertainment, and Recreation",713950,Bowling centers OR Bowling centers,24.31798,31.240376,0
33,Manufacturing,339115,Ophthalmic goods manufacturing OR Ophthalmic goods manufacturing,23.728222,30.211998,0
33,Manufacturing,334517,Irradiation apparatus manufacturing OR Irradiation apparatus manufacturing,24.89753,31.212784,0
33,Manufacturing,336213,Motor home manufacturing OR Motor home manufacturing,27.349007,31.820152,0
53,Real Estate and Rental and Leasing,532230,Video tape and disc rental OR Video tape and disc rental,25.443016,32.317932,0
33,Manufacturing,334510,Electromedical apparatus manufacturing OR Electromedical apparatus manufacturing,26.611488,32.408047,0
31,Manufacturing,3122A0,Tobacco product manufacturing OR Tobacco product manufacturing,27.86133,33.402462,0
62,Health Care and Social Assistance,622000,Hospitals OR Hospitals,25.69792,33.14964,0
62,Health Care and Social Assistance,621A00,"Offices of physicians, dentists, and other health practitioners OR Offices of physicians, dentists, and other health practitioners",26.788872,33.255196,0
33,Manufacturing,336992,Military armored vehicles and tank parts manufacturing OR Military armored vehicles and tank parts manufacturing,27.237291,32.783764,0
31,Manufacturing,316200,Footwear manufacturing OR Footwear manufacturing,27.918247,32.59045,0
33,Manufacturing,339114,Dental equipment and supplies manufacturing OR Dental equipment and supplies manufacturing,26.476738,33.71997,0
62,Health Care and Social Assistance,624200,"Community food, housing, and other relief services, incl rehabilitation services OR Community food, housing, and other relief services, incl rehabilitation services",27.420925,33.875668,0
33,Manufacturing,339116,Dental laboratories OR Dental laboratories,26.15877,34.462795,0
81,Other Services (except Public Administration),812100,Personal care services OR Personal care services,26.97117,34.374115,0
